{
  "schemaVersion": "1.1.0",
  "version": "1.1.0",
  "runId": "run-1",
  "compatibility": {
    "schemaVersion": "1.1.0"
  },
  "events": [
    {
      "schemaVersion": "1.1.0",
      "version": "1.1.0",
      "id": "ev-1",
      "eventType": "context",
      "actor": {
        "kind": "agent",
        "identity": "agent-a",
        "implementation": {
          "name": "soma",
          "revision": "r1"
        }
      },
      "authority": {
        "executionClass": "deterministic",
        "mutation": "none"
      },
      "effectiveAuthority": {
        "executionClass": "deterministic",
        "mutation": "none"
      },
      "sequence": 0,
      "timestamp": "2026-01-01T00:00:00Z",
      "idempotencyKey": "idem-1",
      "correlationId": "corr-1",
      "repoRevision": "abc123",
      "compatibility": {
        "schemaVersion": "1.1.0",
        "minReaderVersion": "1.0.0"
      },
      "parents": [],
      "semanticDigest": "9177a275de55d38a869cb5de4da276e56c0beba23a42109a896290cb9fa941bd"
    },
    {
      "schemaVersion": "1.1.0",
      "version": "1.1.0",
      "id": "ev-2",
      "eventType": "decision",
      "actor": {
        "kind": "agent",
        "identity": "agent-a",
        "implementation": {
          "name": "soma",
          "revision": "r1"
        }
      },
      "authority": {
        "executionClass": "deterministic",
        "mutation": "none"
      },
      "effectiveAuthority": {
        "executionClass": "deterministic",
        "mutation": "none"
      },
      "sequence": 0,
      "timestamp": "2026-01-01T00:00:00Z",
      "idempotencyKey": "idem-1",
      "correlationId": "corr-1",
      "repoRevision": "abc123",
      "compatibility": {
        "schemaVersion": "1.1.0",
        "minReaderVersion": "1.0.0"
      },
      "parents": [
        "ev-1"
      ],
      "payload": {
        "decision": {
          "decision": "proceed",
          "rationale": "ok"
        }
      },
      "semanticDigest": "b4bed2783097331529bfe0c4d320adcd5216fd79d6b014b79dbd976525958dce"
    }
  ]
}
